{
  "changeEvents": [],
  "claims": [],
  "documents": [],
  "generatedAt": "2026-09-07T15:27:58.909188+00:00",
  "id": "shard:opportunities:fd",
  "opportunities": [
    {
      "applicationWindows": [
        {
          "id": "window:primary",
          "mode": "unknown",
          "opensAt": "2026-09-07T00:00:00+02:00",
          "relativeRule": "Fecha V1 no verificada; requiere contraste documental.",
          "timeZone": "Europe/Madrid",
          "verified": false
        }
      ],
      "authority": {
        "countryCode": "ES",
        "id": "authority:sha256:0e10e088cce19c00ff26723384c7a202f37d57caf6b3003a9566735812dd8372",
        "level": "regional",
        "name": "Principado de Asturias"
      },
      "beneficiaryClasses": [],
      "canonicalReference": "2026-07371",
      "currentVersionId": "oppver:sha256:f1d67f1f5d430a9b38ea9f211d8905c8c4172bf6471e89fb5b9b6abbe9746f6e",
      "documentRevisionIds": [],
      "eligibleActivities": [
        "Asturias",
        "turismo",
        "rural"
      ],
      "excludedActivities": [],
      "family": "grant",
      "finance": {
        "currency": "EUR",
        "eligibleCostNotes": [
          "Cuantía y condiciones por verificar"
        ]
      },
      "geography": {
        "countryCodes": [
          "ES"
        ],
        "executionPlaces": [
          "Asturias"
        ],
        "regionCodes": [
          "ES-AS"
        ],
        "scope": "regional"
      },
      "id": "opp:sha256:8fdc30f5c0e6006223ff5122ca363f9e25125e1e8eea86cafe59354fe42a39d9",
      "incompatibilities": [
        "Confirmar beneficiarios, gastos elegibles e incompatibilidades en las bases."
      ],
      "lifecycleStatus": "open",
      "provenance": {
        "claimIds": [],
        "derivedAt": "2026-09-07T15:27:58.909188+00:00",
        "documentRevisionIds": [],
        "resolverVersion": "resolver-v2.0.0",
        "sourceRecordIds": [
          "src:bopa:2026-07371"
        ]
      },
      "quality": {
        "completeness": 0.5,
        "conflictCount": 0,
        "evidenceCoverage": 0,
        "reviewStatus": "needs_review"
      },
      "relatedOpportunityIds": [],
      "schemaVersion": "2.0.0",
      "sourceRecordIds": [
        "src:bopa:2026-07371"
      ],
      "submission": {
        "channel": "unknown",
        "officialUrl": "https://miprincipado.asturias.es/bopa/disposiciones?p_p_id=pa_sede_bopa_web_portlet_SedeBopaDispositionWeb&p_p_lifecycle=0&_pa_sede_bopa_web_portlet_SedeBopaDispositionWeb_mvcRenderCommandName=%2Fdisposition%2Fdetail&p_r_p_dispositionText=2026-07371&p_r_p_dispositionReference=2026-07371&p_r_p_dispositionDate=07%2F09%2F2026"
      },
      "titles": [
        {
          "language": "es",
          "value": "Extracto de la Resolución de 1 de septiembre de 2026, de la Consejería de Presidencia, Reto Demográfico, Igualdad y Turismo, de segunda convocatoria de subvenciones para la dinamización e incentivación del consumo en los alojamientos rurales del Principado de Asturias a través del Bono Turismo Rural de Asturias 2026."
        }
      ]
    }
  ],
  "schemaVersion": "2.0.0",
  "sourceRecords": [
    {
      "adapter": {
        "name": "v1-public-catalog",
        "schemaVersion": "1",
        "version": "v1-to-v2.1.0.0"
      },
      "canonicalUrl": "https://miprincipado.asturias.es/bopa/disposiciones?p_p_id=pa_sede_bopa_web_portlet_SedeBopaDispositionWeb&p_p_lifecycle=0&_pa_sede_bopa_web_portlet_SedeBopaDispositionWeb_mvcRenderCommandName=%2Fdisposition%2Fdetail&p_r_p_dispositionText=2026-07371&p_r_p_dispositionReference=2026-07371&p_r_p_dispositionDate=07%2F09%2F2026",
      "contentHash": "sha256:4d1043901680f7149d314563187a87af76ac90e0c202d93693c03fa5a1c0d321",
      "externalId": "2026-07371",
      "externalReferences": [
        "2026-07371"
      ],
      "firstObservedAt": "2026-09-07T15:27:58.909188+00:00",
      "http": {
        "contentType": "application/vnd.radar.v1+json",
        "status": 200
      },
      "id": "src:bopa:2026-07371",
      "lastObservedAt": "2026-09-07T15:27:58.909188+00:00",
      "publishedAt": "2026-09-07T00:00:00+02:00",
      "retrieval": {
        "checkedAt": "2026-09-07T15:27:58.909188+00:00",
        "status": "ok"
      },
      "retrievedUrl": "https://miprincipado.asturias.es/bopa/disposiciones?p_p_id=pa_sede_bopa_web_portlet_SedeBopaDispositionWeb&p_p_lifecycle=0&_pa_sede_bopa_web_portlet_SedeBopaDispositionWeb_mvcRenderCommandName=%2Fdisposition%2Fdetail&p_r_p_dispositionText=2026-07371&p_r_p_dispositionReference=2026-07371&p_r_p_dispositionDate=07%2F09%2F2026",
      "schemaVersion": "2.0.0",
      "sourceKey": "bopa"
    }
  ],
  "versions": [
    {
      "claimIds": [],
      "contentHash": "sha256:f1d67f1f5d430a9b38ea9f211d8905c8c4172bf6471e89fb5b9b6abbe9746f6e",
      "documentRevisionIds": [],
      "effectiveAt": "2026-09-07T00:00:00+02:00",
      "id": "oppver:sha256:f1d67f1f5d430a9b38ea9f211d8905c8c4172bf6471e89fb5b9b6abbe9746f6e",
      "observedAt": "2026-09-07T15:27:58.909188+00:00",
      "opportunityId": "opp:sha256:8fdc30f5c0e6006223ff5122ca363f9e25125e1e8eea86cafe59354fe42a39d9",
      "precedenceRuleVersion": "precedence-v2.0.0",
      "schemaVersion": "2.0.0",
      "semanticDiff": [],
      "sequence": 1,
      "snapshot": {
        "applicationWindows": [
          {
            "id": "window:primary",
            "mode": "unknown",
            "opensAt": "2026-09-07T00:00:00+02:00",
            "relativeRule": "Fecha V1 no verificada; requiere contraste documental.",
            "timeZone": "Europe/Madrid",
            "verified": false
          }
        ],
        "authority": {
          "countryCode": "ES",
          "id": "authority:sha256:0e10e088cce19c00ff26723384c7a202f37d57caf6b3003a9566735812dd8372",
          "level": "regional",
          "name": "Principado de Asturias"
        },
        "beneficiaryClasses": [],
        "canonicalReference": "2026-07371",
        "currentVersionId": "oppver:sha256:f1d67f1f5d430a9b38ea9f211d8905c8c4172bf6471e89fb5b9b6abbe9746f6e",
        "documentRevisionIds": [],
        "eligibleActivities": [
          "Asturias",
          "turismo",
          "rural"
        ],
        "excludedActivities": [],
        "family": "grant",
        "finance": {
          "currency": "EUR",
          "eligibleCostNotes": [
            "Cuantía y condiciones por verificar"
          ]
        },
        "geography": {
          "countryCodes": [
            "ES"
          ],
          "executionPlaces": [
            "Asturias"
          ],
          "regionCodes": [
            "ES-AS"
          ],
          "scope": "regional"
        },
        "id": "opp:sha256:8fdc30f5c0e6006223ff5122ca363f9e25125e1e8eea86cafe59354fe42a39d9",
        "incompatibilities": [
          "Confirmar beneficiarios, gastos elegibles e incompatibilidades en las bases."
        ],
        "lifecycleStatus": "open",
        "provenance": {
          "claimIds": [],
          "derivedAt": "2026-09-07T15:27:58.909188+00:00",
          "documentRevisionIds": [],
          "resolverVersion": "resolver-v2.0.0",
          "sourceRecordIds": [
            "src:bopa:2026-07371"
          ]
        },
        "quality": {
          "completeness": 0.5,
          "conflictCount": 0,
          "evidenceCoverage": 0,
          "reviewStatus": "needs_review"
        },
        "relatedOpportunityIds": [],
        "schemaVersion": "2.0.0",
        "sourceRecordIds": [
          "src:bopa:2026-07371"
        ],
        "submission": {
          "channel": "unknown",
          "officialUrl": "https://miprincipado.asturias.es/bopa/disposiciones?p_p_id=pa_sede_bopa_web_portlet_SedeBopaDispositionWeb&p_p_lifecycle=0&_pa_sede_bopa_web_portlet_SedeBopaDispositionWeb_mvcRenderCommandName=%2Fdisposition%2Fdetail&p_r_p_dispositionText=2026-07371&p_r_p_dispositionReference=2026-07371&p_r_p_dispositionDate=07%2F09%2F2026"
        },
        "titles": [
          {
            "language": "es",
            "value": "Extracto de la Resolución de 1 de septiembre de 2026, de la Consejería de Presidencia, Reto Demográfico, Igualdad y Turismo, de segunda convocatoria de subvenciones para la dinamización e incentivación del consumo en los alojamientos rurales del Principado de Asturias a través del Bono Turismo Rural de Asturias 2026."
          }
        ]
      },
      "sourceRecordIds": [
        "src:bopa:2026-07371"
      ]
    }
  ]
}
